{
  "schema": "stegverse.candidate_bundle_ref.v1",
  "candidate_id": "sv002.m11.apply-review.v1",
  "source_type": "release_asset",
  "source": "https://github.com/StegVerse-002/core-lite/releases/download/candidate/sv002_m11_governed_apply_review_boundary_bundle.zip",
  "expected_sha256": "sha256:0000000000000000000000000000000000000000000000000000000000000000",
  "declared_transition_class": "tooling",
  "declared_stage": "SV002-M10",
  "authority_ref": "SV002-M10.5/candidate-review-only",
  "policy_ref": "triad/default-deny/no-broad-authority",
  "operator_context": {
    "requester": "Rigel",
    "role": "founder/operator",
    "approval_intent": "review_only"
  },
  "created_utc": "2026-05-28T00:00:00+00:00",
  "notes": "Example only. Replace expected_sha256 with the actual hash of the candidate bundle before use."
}
